{
  "schemaVersion": 1,
  "id": "alankar-2-three-steps",
  "title": "Alankar 2 — Three steps",
  "composer": "Traditional",
  "from": "Hindustani practice",
  "arrangement": {
    "by": "FluteSim",
    "notes": "Groups of three: Sa Re Ga, Re Ga Ma, … up to taar Sa and back down."
  },
  "instrument": "bansuri",
  "holes": 6,
  "tempo": 80,
  "timeSignature": [
    3,
    4
  ],
  "sourceKey": "C major",
  "saInSource": "C4",
  "recommendedScale": "C",
  "difficulty": "easy",
  "totalBeats": 42.0,
  "sections": [
    {
      "name": "Aaroh",
      "bar": 1
    },
    {
      "name": "Avaroh",
      "bar": 8
    }
  ],
  "notes": [
    {"bar":1,"beat":0.0,"dur":1.0,"swar":"Sa","octave":"madhya","western":"C4","blow":"medium","stress":0.85,"articulation":"tongued"},
    {"bar":1,"beat":1.0,"dur":1.0,"swar":"Re","octave":"madhya","western":"D4","blow":"medium","stress":0.5,"articulation":"tongued"},
    {"bar":1,"beat":2.0,"dur":1.0,"swar":"Ga","octave":"madhya","western":"E4","blow":"medium","stress":0.5,"articulation":"tongued"},
    {"bar":2,"beat":3.0,"dur":1.0,"swar":"Re","octave":"madhya","western":"D4","blow":"medium","stress":0.85,"articulation":"tongued"},
    {"bar":2,"beat":4.0,"dur":1.0,"swar":"Ga","octave":"madhya","western":"E4","blow":"medium","stress":0.5,"articulation":"tongued"},
    {"bar":2,"beat":5.0,"dur":1.0,"swar":"Ma","octave":"madhya","western":"F4","blow":"medium","stress":0.5,"articulation":"tongued"},
    {"bar":3,"beat":6.0,"dur":1.0,"swar":"Ga","octave":"madhya","western":"E4","blow":"medium","stress":0.85,"articulation":"tongued"},
    {"bar":3,"beat":7.0,"dur":1.0,"swar":"Ma","octave":"madhya","western":"F4","blow":"medium","stress":0.5,"articulation":"tongued"},
    {"bar":3,"beat":8.0,"dur":1.0,"swar":"Pa","octave":"madhya","western":"G4","blow":"strong","stress":0.5,"articulation":"tongued"},
    {"bar":4,"beat":9.0,"dur":1.0,"swar":"Ma","octave":"madhya","western":"F4","blow":"medium","stress":0.85,"articulation":"tongued"},
    {"bar":4,"beat":10.0,"dur":1.0,"swar":"Pa","octave":"madhya","western":"G4","blow":"strong","stress":0.5,"articulation":"tongued"},
    {"bar":4,"beat":11.0,"dur":1.0,"swar":"Dha","octave":"madhya","western":"A4","blow":"strong","stress":0.5,"articulation":"tongued"},
    {"bar":5,"beat":12.0,"dur":1.0,"swar":"Pa","octave":"madhya","western":"G4","blow":"strong","stress":0.85,"articulation":"tongued"},
    {"bar":5,"beat":13.0,"dur":1.0,"swar":"Dha","octave":"madhya","western":"A4","blow":"strong","stress":0.5,"articulation":"tongued"},
    {"bar":5,"beat":14.0,"dur":1.0,"swar":"Ni","octave":"madhya","western":"B4","blow":"strong","stress":0.5,"articulation":"tongued"},
    {"bar":6,"beat":15.0,"dur":1.0,"swar":"Dha","octave":"madhya","western":"A4","blow":"strong","stress":0.85,"articulation":"tongued"},
    {"bar":6,"beat":16.0,"dur":1.0,"swar":"Ni","octave":"madhya","western":"B4","blow":"strong","stress":0.5,"articulation":"tongued"},
    {"bar":6,"beat":17.0,"dur":1.0,"swar":"Sa","octave":"taar","western":"C5","blow":"strong","stress":0.5,"articulation":"tongued","breathAfter":true},
    {"bar":8,"beat":21.0,"dur":1.0,"swar":"Sa","octave":"taar","western":"C5","blow":"strong","stress":0.85,"articulation":"tongued"},
    {"bar":8,"beat":22.0,"dur":1.0,"swar":"Ni","octave":"madhya","western":"B4","blow":"strong","stress":0.5,"articulation":"tongued"},
    {"bar":8,"beat":23.0,"dur":1.0,"swar":"Dha","octave":"madhya","western":"A4","blow":"strong","stress":0.5,"articulation":"tongued"},
    {"bar":9,"beat":24.0,"dur":1.0,"swar":"Ni","octave":"madhya","western":"B4","blow":"strong","stress":0.85,"articulation":"tongued"},
    {"bar":9,"beat":25.0,"dur":1.0,"swar":"Dha","octave":"madhya","western":"A4","blow":"strong","stress":0.5,"articulation":"tongued"},
    {"bar":9,"beat":26.0,"dur":1.0,"swar":"Pa","octave":"madhya","western":"G4","blow":"strong","stress":0.5,"articulation":"tongued"},
    {"bar":10,"beat":27.0,"dur":1.0,"swar":"Dha","octave":"madhya","western":"A4","blow":"strong","stress":0.85,"articulation":"tongued"},
    {"bar":10,"beat":28.0,"dur":1.0,"swar":"Pa","octave":"madhya","western":"G4","blow":"strong","stress":0.5,"articulation":"tongued"},
    {"bar":10,"beat":29.0,"dur":1.0,"swar":"Ma","octave":"madhya","western":"F4","blow":"medium","stress":0.5,"articulation":"tongued"},
    {"bar":11,"beat":30.0,"dur":1.0,"swar":"Pa","octave":"madhya","western":"G4","blow":"strong","stress":0.85,"articulation":"tongued"},
    {"bar":11,"beat":31.0,"dur":1.0,"swar":"Ma","octave":"madhya","western":"F4","blow":"medium","stress":0.5,"articulation":"tongued"},
    {"bar":11,"beat":32.0,"dur":1.0,"swar":"Ga","octave":"madhya","western":"E4","blow":"medium","stress":0.5,"articulation":"tongued"},
    {"bar":12,"beat":33.0,"dur":1.0,"swar":"Ma","octave":"madhya","western":"F4","blow":"medium","stress":0.85,"articulation":"tongued"},
    {"bar":12,"beat":34.0,"dur":1.0,"swar":"Ga","octave":"madhya","western":"E4","blow":"medium","stress":0.5,"articulation":"tongued"},
    {"bar":12,"beat":35.0,"dur":1.0,"swar":"Re","octave":"madhya","western":"D4","blow":"medium","stress":0.5,"articulation":"tongued"},
    {"bar":13,"beat":36.0,"dur":1.0,"swar":"Ga","octave":"madhya","western":"E4","blow":"medium","stress":0.85,"articulation":"tongued"},
    {"bar":13,"beat":37.0,"dur":1.0,"swar":"Re","octave":"madhya","western":"D4","blow":"medium","stress":0.5,"articulation":"tongued"},
    {"bar":13,"beat":38.0,"dur":3.0,"swar":"Sa","octave":"madhya","western":"C4","blow":"medium","stress":0.7,"articulation":"tongued","breathAfter":true}
  ]
}
