{
  "schemaVersion": 1,
  "id": "happy-birthday",
  "title": "Happy Birthday",
  "composer": "Mildred J. Hill & Patty Hill",
  "from": "Public domain",
  "arrangement": {
    "by": "FluteSim",
    "notes": "In C (C = Sa): starts on mandra Pa and stays between mandra Pa and madhya Pa."
  },
  "instrument": "bansuri",
  "holes": 6,
  "tempo": 100,
  "timeSignature": [
    3,
    4
  ],
  "sourceKey": "C major",
  "saInSource": "C4",
  "recommendedScale": "C",
  "difficulty": "easy",
  "totalBeats": 27.0,
  "sections": [
    {
      "name": "Verse",
      "bar": 1
    }
  ],
  "notes": [
    {"bar":1,"beat":2.0,"dur":0.75,"swar":"Pa","octave":"mandra","western":"G3","blow":"soft","stress":0.5,"articulation":"tongued"},
    {"bar":1,"beat":2.75,"dur":0.25,"swar":"Pa","octave":"mandra","western":"G3","blow":"soft","stress":0.35,"articulation":"tongued"},
    {"bar":2,"beat":3.0,"dur":1.0,"swar":"Dha","octave":"mandra","western":"A3","blow":"soft","stress":0.85,"articulation":"tongued"},
    {"bar":2,"beat":4.0,"dur":1.0,"swar":"Pa","octave":"mandra","western":"G3","blow":"soft","stress":0.5,"articulation":"tongued"},
    {"bar":2,"beat":5.0,"dur":1.0,"swar":"Sa","octave":"madhya","western":"C4","blow":"medium","stress":0.5,"articulation":"tongued"},
    {"bar":3,"beat":6.0,"dur":2.0,"swar":"Ni","octave":"mandra","western":"B3","blow":"soft","stress":0.85,"articulation":"tongued","breathAfter":true},
    {"bar":3,"beat":8.0,"dur":0.75,"swar":"Pa","octave":"mandra","western":"G3","blow":"soft","stress":0.5,"articulation":"tongued"},
    {"bar":3,"beat":8.75,"dur":0.25,"swar":"Pa","octave":"mandra","western":"G3","blow":"soft","stress":0.35,"articulation":"tongued"},
    {"bar":4,"beat":9.0,"dur":1.0,"swar":"Dha","octave":"mandra","western":"A3","blow":"soft","stress":0.85,"articulation":"tongued"},
    {"bar":4,"beat":10.0,"dur":1.0,"swar":"Pa","octave":"mandra","western":"G3","blow":"soft","stress":0.5,"articulation":"tongued"},
    {"bar":4,"beat":11.0,"dur":1.0,"swar":"Re","octave":"madhya","western":"D4","blow":"medium","stress":0.5,"articulation":"tongued"},
    {"bar":5,"beat":12.0,"dur":2.0,"swar":"Sa","octave":"madhya","western":"C4","blow":"medium","stress":0.85,"articulation":"tongued","breathAfter":true},
    {"bar":5,"beat":14.0,"dur":0.75,"swar":"Pa","octave":"mandra","western":"G3","blow":"soft","stress":0.5,"articulation":"tongued"},
    {"bar":5,"beat":14.75,"dur":0.25,"swar":"Pa","octave":"mandra","western":"G3","blow":"soft","stress":0.35,"articulation":"tongued"},
    {"bar":6,"beat":15.0,"dur":1.0,"swar":"Pa","octave":"madhya","western":"G4","blow":"strong","stress":0.85,"articulation":"tongued"},
    {"bar":6,"beat":16.0,"dur":1.0,"swar":"Ga","octave":"madhya","western":"E4","blow":"medium","stress":0.5,"articulation":"tongued"},
    {"bar":6,"beat":17.0,"dur":1.0,"swar":"Sa","octave":"madhya","western":"C4","blow":"medium","stress":0.5,"articulation":"tongued"},
    {"bar":7,"beat":18.0,"dur":1.0,"swar":"Ni","octave":"mandra","western":"B3","blow":"soft","stress":0.85,"articulation":"tongued"},
    {"bar":7,"beat":19.0,"dur":1.0,"swar":"Dha","octave":"mandra","western":"A3","blow":"soft","stress":0.5,"articulation":"tongued","breathAfter":true},
    {"bar":7,"beat":20.0,"dur":0.75,"swar":"Ma","octave":"madhya","western":"F4","blow":"medium","stress":0.5,"articulation":"tongued"},
    {"bar":7,"beat":20.75,"dur":0.25,"swar":"Ma","octave":"madhya","western":"F4","blow":"medium","stress":0.35,"articulation":"tongued"},
    {"bar":8,"beat":21.0,"dur":1.0,"swar":"Ga","octave":"madhya","western":"E4","blow":"medium","stress":0.85,"articulation":"tongued"},
    {"bar":8,"beat":22.0,"dur":1.0,"swar":"Sa","octave":"madhya","western":"C4","blow":"medium","stress":0.5,"articulation":"tongued"},
    {"bar":8,"beat":23.0,"dur":1.0,"swar":"Re","octave":"madhya","western":"D4","blow":"medium","stress":0.5,"articulation":"tongued"},
    {"bar":9,"beat":24.0,"dur":3.0,"swar":"Sa","octave":"madhya","western":"C4","blow":"medium","stress":0.85,"articulation":"tongued","breathAfter":true}
  ]
}
