{
  "schemaVersion": 1,
  "id": "raag-yaman",
  "title": "Raag Yaman — Aaroh, avaroh, pakad",
  "composer": "Traditional",
  "from": "Hindustani classical, Kalyan thaat",
  "arrangement": {
    "by": "FluteSim",
    "notes": "Evening raag with tivra Ma. Aaroh N R G M# D N S, avaroh S N D P M# G R S, pakad N R G R, P R, N R S."
  },
  "instrument": "bansuri",
  "holes": 6,
  "tempo": 60,
  "timeSignature": [
    4,
    4
  ],
  "sourceKey": "C major",
  "saInSource": "C4",
  "recommendedScale": "C",
  "difficulty": "medium",
  "totalBeats": 28.0,
  "sections": [
    {
      "name": "Aaroh",
      "bar": 1
    },
    {
      "name": "Avaroh",
      "bar": 3
    },
    {
      "name": "Pakad",
      "bar": 5
    }
  ],
  "notes": [
    {"bar":1,"beat":0.0,"dur":1.0,"swar":"Ni","octave":"mandra","western":"B3","blow":"soft","stress":0.85,"articulation":"tongued"},
    {"bar":1,"beat":1.0,"dur":1.0,"swar":"Re","octave":"madhya","western":"D4","blow":"medium","stress":0.5,"articulation":"tongued"},
    {"bar":1,"beat":2.0,"dur":1.0,"swar":"Ga","octave":"madhya","western":"E4","blow":"medium","stress":0.65,"articulation":"tongued"},
    {"bar":1,"beat":3.0,"dur":1.0,"swar":"Ma","variant":"tivra","octave":"madhya","western":"F#4","blow":"medium","stress":0.5,"articulation":"tongued"},
    {"bar":2,"beat":4.0,"dur":1.0,"swar":"Dha","octave":"madhya","western":"A4","blow":"strong","stress":0.85,"articulation":"tongued"},
    {"bar":2,"beat":5.0,"dur":1.0,"swar":"Ni","octave":"madhya","western":"B4","blow":"strong","stress":0.5,"articulation":"tongued"},
    {"bar":2,"beat":6.0,"dur":2.0,"swar":"Sa","octave":"taar","western":"C5","blow":"strong","stress":0.7,"articulation":"tongued","breathAfter":true},
    {"bar":3,"beat":8.0,"dur":1.0,"swar":"Sa","octave":"taar","western":"C5","blow":"strong","stress":0.85,"articulation":"tongued"},
    {"bar":3,"beat":9.0,"dur":1.0,"swar":"Ni","octave":"madhya","western":"B4","blow":"strong","stress":0.5,"articulation":"tongued"},
    {"bar":3,"beat":10.0,"dur":1.0,"swar":"Dha","octave":"madhya","western":"A4","blow":"strong","stress":0.65,"articulation":"tongued"},
    {"bar":3,"beat":11.0,"dur":1.0,"swar":"Pa","octave":"madhya","western":"G4","blow":"strong","stress":0.5,"articulation":"tongued"},
    {"bar":4,"beat":12.0,"dur":1.0,"swar":"Ma","variant":"tivra","octave":"madhya","western":"F#4","blow":"medium","stress":0.85,"articulation":"tongued"},
    {"bar":4,"beat":13.0,"dur":1.0,"swar":"Ga","octave":"madhya","western":"E4","blow":"medium","stress":0.5,"articulation":"tongued"},
    {"bar":4,"beat":14.0,"dur":1.0,"swar":"Re","octave":"madhya","western":"D4","blow":"medium","stress":0.65,"articulation":"tongued"},
    {"bar":4,"beat":15.0,"dur":1.0,"swar":"Sa","octave":"madhya","western":"C4","blow":"medium","stress":0.5,"articulation":"tongued","breathAfter":true},
    {"bar":5,"beat":16.0,"dur":1.0,"swar":"Ni","octave":"mandra","western":"B3","blow":"soft","stress":0.85,"articulation":"tongued"},
    {"bar":5,"beat":17.0,"dur":1.0,"swar":"Re","octave":"madhya","western":"D4","blow":"medium","stress":0.5,"articulation":"tongued"},
    {"bar":5,"beat":18.0,"dur":1.0,"swar":"Ga","octave":"madhya","western":"E4","blow":"medium","stress":0.65,"articulation":"tongued"},
    {"bar":5,"beat":19.0,"dur":1.0,"swar":"Re","octave":"madhya","western":"D4","blow":"medium","stress":0.5,"articulation":"tongued","breathAfter":true},
    {"bar":6,"beat":20.0,"dur":2.0,"swar":"Pa","octave":"madhya","western":"G4","blow":"strong","stress":0.85,"articulation":"tongued"},
    {"bar":6,"beat":22.0,"dur":2.0,"swar":"Re","octave":"madhya","western":"D4","blow":"medium","stress":0.7,"articulation":"tongued"},
    {"bar":7,"beat":24.0,"dur":1.0,"swar":"Ni","octave":"mandra","western":"B3","blow":"soft","stress":0.85,"articulation":"tongued"},
    {"bar":7,"beat":25.0,"dur":1.0,"swar":"Re","octave":"madhya","western":"D4","blow":"medium","stress":0.5,"articulation":"tongued"},
    {"bar":7,"beat":26.0,"dur":2.0,"swar":"Sa","octave":"madhya","western":"C4","blow":"medium","stress":0.7,"articulation":"tongued","breathAfter":true}
  ]
}
