{
  "schemaVersion": 1,
  "id": "ode-to-joy",
  "title": "Ode to Joy",
  "composer": "Ludwig van Beethoven",
  "from": "Symphony No. 9 (1824)",
  "arrangement": {
    "by": "FluteSim",
    "notes": "The main theme from the last movement, in C (C = Sa)."
  },
  "instrument": "bansuri",
  "holes": 6,
  "tempo": 100,
  "timeSignature": [
    4,
    4
  ],
  "sourceKey": "C major",
  "saInSource": "C4",
  "recommendedScale": "C",
  "difficulty": "easy",
  "totalBeats": 64.0,
  "sections": [
    {
      "name": "A",
      "bar": 1
    },
    {
      "name": "A",
      "bar": 5
    },
    {
      "name": "B",
      "bar": 9
    },
    {
      "name": "A",
      "bar": 13
    }
  ],
  "notes": [
    {"bar":1,"beat":0.0,"dur":1.0,"swar":"Ga","octave":"madhya","western":"E4","blow":"medium","stress":0.85,"articulation":"tongued"},
    {"bar":1,"beat":1.0,"dur":1.0,"swar":"Ga","octave":"madhya","western":"E4","blow":"medium","stress":0.5,"articulation":"tongued"},
    {"bar":1,"beat":2.0,"dur":1.0,"swar":"Ma","octave":"madhya","western":"F4","blow":"medium","stress":0.65,"articulation":"tongued"},
    {"bar":1,"beat":3.0,"dur":1.0,"swar":"Pa","octave":"madhya","western":"G4","blow":"strong","stress":0.5,"articulation":"tongued"},
    {"bar":2,"beat":4.0,"dur":1.0,"swar":"Pa","octave":"madhya","western":"G4","blow":"strong","stress":0.85,"articulation":"tongued"},
    {"bar":2,"beat":5.0,"dur":1.0,"swar":"Ma","octave":"madhya","western":"F4","blow":"medium","stress":0.5,"articulation":"tongued"},
    {"bar":2,"beat":6.0,"dur":1.0,"swar":"Ga","octave":"madhya","western":"E4","blow":"medium","stress":0.65,"articulation":"tongued"},
    {"bar":2,"beat":7.0,"dur":1.0,"swar":"Re","octave":"madhya","western":"D4","blow":"medium","stress":0.5,"articulation":"tongued"},
    {"bar":3,"beat":8.0,"dur":1.0,"swar":"Sa","octave":"madhya","western":"C4","blow":"medium","stress":0.85,"articulation":"tongued"},
    {"bar":3,"beat":9.0,"dur":1.0,"swar":"Sa","octave":"madhya","western":"C4","blow":"medium","stress":0.5,"articulation":"tongued"},
    {"bar":3,"beat":10.0,"dur":1.0,"swar":"Re","octave":"madhya","western":"D4","blow":"medium","stress":0.65,"articulation":"tongued"},
    {"bar":3,"beat":11.0,"dur":1.0,"swar":"Ga","octave":"madhya","western":"E4","blow":"medium","stress":0.5,"articulation":"tongued"},
    {"bar":4,"beat":12.0,"dur":1.5,"swar":"Ga","octave":"madhya","western":"E4","blow":"medium","stress":0.85,"articulation":"tongued"},
    {"bar":4,"beat":13.5,"dur":0.5,"swar":"Re","octave":"madhya","western":"D4","blow":"medium","stress":0.35,"articulation":"tongued"},
    {"bar":4,"beat":14.0,"dur":2.0,"swar":"Re","octave":"madhya","western":"D4","blow":"medium","stress":0.7,"articulation":"tongued","breathAfter":true},
    {"bar":5,"beat":16.0,"dur":1.0,"swar":"Ga","octave":"madhya","western":"E4","blow":"medium","stress":0.85,"articulation":"tongued"},
    {"bar":5,"beat":17.0,"dur":1.0,"swar":"Ga","octave":"madhya","western":"E4","blow":"medium","stress":0.5,"articulation":"tongued"},
    {"bar":5,"beat":18.0,"dur":1.0,"swar":"Ma","octave":"madhya","western":"F4","blow":"medium","stress":0.65,"articulation":"tongued"},
    {"bar":5,"beat":19.0,"dur":1.0,"swar":"Pa","octave":"madhya","western":"G4","blow":"strong","stress":0.5,"articulation":"tongued"},
    {"bar":6,"beat":20.0,"dur":1.0,"swar":"Pa","octave":"madhya","western":"G4","blow":"strong","stress":0.85,"articulation":"tongued"},
    {"bar":6,"beat":21.0,"dur":1.0,"swar":"Ma","octave":"madhya","western":"F4","blow":"medium","stress":0.5,"articulation":"tongued"},
    {"bar":6,"beat":22.0,"dur":1.0,"swar":"Ga","octave":"madhya","western":"E4","blow":"medium","stress":0.65,"articulation":"tongued"},
    {"bar":6,"beat":23.0,"dur":1.0,"swar":"Re","octave":"madhya","western":"D4","blow":"medium","stress":0.5,"articulation":"tongued"},
    {"bar":7,"beat":24.0,"dur":1.0,"swar":"Sa","octave":"madhya","western":"C4","blow":"medium","stress":0.85,"articulation":"tongued"},
    {"bar":7,"beat":25.0,"dur":1.0,"swar":"Sa","octave":"madhya","western":"C4","blow":"medium","stress":0.5,"articulation":"tongued"},
    {"bar":7,"beat":26.0,"dur":1.0,"swar":"Re","octave":"madhya","western":"D4","blow":"medium","stress":0.65,"articulation":"tongued"},
    {"bar":7,"beat":27.0,"dur":1.0,"swar":"Ga","octave":"madhya","western":"E4","blow":"medium","stress":0.5,"articulation":"tongued"},
    {"bar":8,"beat":28.0,"dur":1.5,"swar":"Re","octave":"madhya","western":"D4","blow":"medium","stress":0.85,"articulation":"tongued"},
    {"bar":8,"beat":29.5,"dur":0.5,"swar":"Sa","octave":"madhya","western":"C4","blow":"medium","stress":0.35,"articulation":"tongued"},
    {"bar":8,"beat":30.0,"dur":2.0,"swar":"Sa","octave":"madhya","western":"C4","blow":"medium","stress":0.7,"articulation":"tongued","breathAfter":true},
    {"bar":9,"beat":32.0,"dur":1.0,"swar":"Re","octave":"madhya","western":"D4","blow":"medium","stress":0.85,"articulation":"tongued"},
    {"bar":9,"beat":33.0,"dur":1.0,"swar":"Re","octave":"madhya","western":"D4","blow":"medium","stress":0.5,"articulation":"tongued"},
    {"bar":9,"beat":34.0,"dur":1.0,"swar":"Ga","octave":"madhya","western":"E4","blow":"medium","stress":0.65,"articulation":"tongued"},
    {"bar":9,"beat":35.0,"dur":1.0,"swar":"Sa","octave":"madhya","western":"C4","blow":"medium","stress":0.5,"articulation":"tongued"},
    {"bar":10,"beat":36.0,"dur":1.0,"swar":"Re","octave":"madhya","western":"D4","blow":"medium","stress":0.85,"articulation":"tongued"},
    {"bar":10,"beat":37.0,"dur":0.5,"swar":"Ga","octave":"madhya","western":"E4","blow":"medium","stress":0.5,"articulation":"tongued"},
    {"bar":10,"beat":37.5,"dur":0.5,"swar":"Ma","octave":"madhya","western":"F4","blow":"medium","stress":0.35,"articulation":"tongued"},
    {"bar":10,"beat":38.0,"dur":1.0,"swar":"Ga","octave":"madhya","western":"E4","blow":"medium","stress":0.65,"articulation":"tongued"},
    {"bar":10,"beat":39.0,"dur":1.0,"swar":"Sa","octave":"madhya","western":"C4","blow":"medium","stress":0.5,"articulation":"tongued"},
    {"bar":11,"beat":40.0,"dur":1.0,"swar":"Re","octave":"madhya","western":"D4","blow":"medium","stress":0.85,"articulation":"tongued"},
    {"bar":11,"beat":41.0,"dur":0.5,"swar":"Ga","octave":"madhya","western":"E4","blow":"medium","stress":0.5,"articulation":"tongued"},
    {"bar":11,"beat":41.5,"dur":0.5,"swar":"Ma","octave":"madhya","western":"F4","blow":"medium","stress":0.35,"articulation":"tongued"},
    {"bar":11,"beat":42.0,"dur":1.0,"swar":"Ga","octave":"madhya","western":"E4","blow":"medium","stress":0.65,"articulation":"tongued"},
    {"bar":11,"beat":43.0,"dur":1.0,"swar":"Re","octave":"madhya","western":"D4","blow":"medium","stress":0.5,"articulation":"tongued"},
    {"bar":12,"beat":44.0,"dur":1.0,"swar":"Sa","octave":"madhya","western":"C4","blow":"medium","stress":0.85,"articulation":"tongued"},
    {"bar":12,"beat":45.0,"dur":1.0,"swar":"Re","octave":"madhya","western":"D4","blow":"medium","stress":0.5,"articulation":"tongued"},
    {"bar":12,"beat":46.0,"dur":2.0,"swar":"Pa","octave":"mandra","western":"G3","blow":"soft","stress":0.7,"articulation":"tongued","breathAfter":true},
    {"bar":13,"beat":48.0,"dur":1.0,"swar":"Ga","octave":"madhya","western":"E4","blow":"medium","stress":0.85,"articulation":"tongued"},
    {"bar":13,"beat":49.0,"dur":1.0,"swar":"Ga","octave":"madhya","western":"E4","blow":"medium","stress":0.5,"articulation":"tongued"},
    {"bar":13,"beat":50.0,"dur":1.0,"swar":"Ma","octave":"madhya","western":"F4","blow":"medium","stress":0.65,"articulation":"tongued"},
    {"bar":13,"beat":51.0,"dur":1.0,"swar":"Pa","octave":"madhya","western":"G4","blow":"strong","stress":0.5,"articulation":"tongued"},
    {"bar":14,"beat":52.0,"dur":1.0,"swar":"Pa","octave":"madhya","western":"G4","blow":"strong","stress":0.85,"articulation":"tongued"},
    {"bar":14,"beat":53.0,"dur":1.0,"swar":"Ma","octave":"madhya","western":"F4","blow":"medium","stress":0.5,"articulation":"tongued"},
    {"bar":14,"beat":54.0,"dur":1.0,"swar":"Ga","octave":"madhya","western":"E4","blow":"medium","stress":0.65,"articulation":"tongued"},
    {"bar":14,"beat":55.0,"dur":1.0,"swar":"Re","octave":"madhya","western":"D4","blow":"medium","stress":0.5,"articulation":"tongued"},
    {"bar":15,"beat":56.0,"dur":1.0,"swar":"Sa","octave":"madhya","western":"C4","blow":"medium","stress":0.85,"articulation":"tongued"},
    {"bar":15,"beat":57.0,"dur":1.0,"swar":"Sa","octave":"madhya","western":"C4","blow":"medium","stress":0.5,"articulation":"tongued"},
    {"bar":15,"beat":58.0,"dur":1.0,"swar":"Re","octave":"madhya","western":"D4","blow":"medium","stress":0.65,"articulation":"tongued"},
    {"bar":15,"beat":59.0,"dur":1.0,"swar":"Ga","octave":"madhya","western":"E4","blow":"medium","stress":0.5,"articulation":"tongued"},
    {"bar":16,"beat":60.0,"dur":1.5,"swar":"Re","octave":"madhya","western":"D4","blow":"medium","stress":0.85,"articulation":"tongued"},
    {"bar":16,"beat":61.5,"dur":0.5,"swar":"Sa","octave":"madhya","western":"C4","blow":"medium","stress":0.35,"articulation":"tongued"},
    {"bar":16,"beat":62.0,"dur":2.0,"swar":"Sa","octave":"madhya","western":"C4","blow":"medium","stress":0.7,"articulation":"tongued","breathAfter":true}
  ]
}
